swiss_french,standard_french,dialect,part_of_speech,definition,source,notes
abandonner (s'),marcher seul,vaud,verb reflexive,Ce verbe ne peut s'employer que dans l'expression: cet enfant s'abandonne (il commence à marcher seul),Glossaire vaudois (1861),ABANDONNER
abatis,pieds/cou/tête de volaille,vaud,masculine noun,Les pieds le cou la tête etc. d'une volaille,Glossaire vaudois (1861),ABATIS
abattre,faire du travail,vaud,verb,il a de l'ouvrage tant qu'il en peut battre (doit être: abattre),Glossaire vaudois (1861),ABATTRE  
abat-voix,dessus de chaire,vaud,masculine noun,Dessus d'une chaire à prêcher (N.P. le dais le ciel),Glossaire vaudois (1861),ABAT-VOIX
abc,livre d'alphabet,vaud,masculine noun,Livre pour apprendre à lire aux enfants (N.P. une palette; D. un ABC un abécé),Glossaire vaudois (1861),ABC
abominable,très mauvais,vaud,adjective,Se dit de tout ce qui est très mauvais en son genre (on ne peut pas dire: cet homme est d'une force abominable),Glossaire vaudois (1861),ABOMINABLE
abonnir,rendre meilleur,vaud,verb,Rendre meilleur (N.P. bonner),Glossaire vaudois (1861),ABONNIR
abri,se mettre à l'abri,vaud,masculine noun,Se mettre à l'abri sous un parapluie sous un arbre (N.P. à la chotte),Glossaire vaudois (1861),ABRI
